{
  "schema_version": "t2v-frozen-file-manifest-v1",
  "manifest_id": "ab-real-lessons-dev-v1-lesson-002-track-b-audio-v1",
  "artifact_type": "audio",
  "files": [
    {
      "file_id": "lesson-002-frozen-audio-spec",
      "role": "audio-generation-spec",
      "path": "datasets/research_generation_v2/frozen/ab-real-lessons-dev-v1/inputs/lesson_002_audio_spec.json",
      "sha256": "3dccf4547aa2fec6da8f487b727599f1ce17b7ce163552fe9edfd2b4e73ffc6c"
    },
    {
      "file_id": "lesson-002-audio-source-script",
      "role": "audio-source-script",
      "path": "datasets/research_generation_v2/frozen/ab-real-lessons-dev-v1/cases/lesson_002/baseline/script.txt",
      "sha256": "b39ebfe1691d124959feea70a19ca61d2ec20d96d8b4d6d049d9553d6da917ec"
    },
    {
      "file_id": "lesson-002-audio-source-storyboard",
      "role": "audio-source-storyboard",
      "path": "datasets/research_generation_v2/frozen/ab-real-lessons-dev-v1/cases/lesson_002/baseline/storyboard.json",
      "sha256": "f9a66d016659549d10e51004048f3824d74db7d70bd188e0c405c57893b61824"
    }
  ]
}
